id,date,tweet
1367068600150888450,2021-03-03 11:05:27+00:00,"占の🦉にメロメロになった傭が占の指導の元🦉を飼いはじめ、ゲームへ連れていった結果

ちょっと怪我するたびに占より大きな心労抱えるようになって

「占、もうお前に手を貸して早くって言わねぇよ⋯😢」って誓う傭と

「いや、気持ちは嬉しいけど私のアイデンティティが⋯😅」って戸惑う占が見たい"
1367033378831101958,2021-03-03 08:45:30+00:00,ポルノの月飼い、歌詞見ました。ライカでは无限様に春を感じてたのですが割と逆っぽいイメージの月も…感じる…无限様を感じる…こちらはこう、闇を抱えつつも表には出さない無理して微笑む无限様が頭に浮かびましたね…映画でも最初の登場では背景月でしたし无限様=月は公式ですね&gt;RT
1367010723906248705,2021-03-03 07:15:29+00:00,"若く出来てすぐ離れて親が面倒みててその間にすぐ次作って次々出来て最初の子は親任せの放任で家族はその後のメンバーだけみたいなキャッキャやってる多頭飼いの典型
上の子がとぼとぼ帰ってるのによく平気だよね"
1366992993236881408,2021-03-03 06:05:01+00:00,"🤖ブログ初心者が意識すべきポイント
【最初にサイト設計しちゃう】

事前にサイト設計すれば、毎日何か書くか悩まなくなる😎

（例）虫　だったらさ、

・虫　飼い方
・虫　冬眠
・虫　食べ物

ってKWを事前リサーチして書いてこうぜってこと☝️

＃ブログ書け
＃ブログ初心者
＃アフィリエイト初心者"
1366911330880417793,2021-03-03 00:40:31+00:00,"犬の飼いはじめに必要な費用は次のとおりです。

犬の登録：3,000円
狂犬病予防注射：3,500円
健康診断：5,000円～
ワクチン接種：1万5,000円～
ペット用品：2万円～"
1366750975164174337,2021-03-02 14:03:20+00:00,最初期の散策でシルがフェリのこと探してるの何回見ても飼い猫探してるテンションなのちょっと笑うわ
1366437300914192384,2021-03-01 17:16:54+00:00,"今回も長時間お疲れ様でしたー！
加えて、登録者数20万人突破おめでとうございます！🥳🎉
最初のパンイチ状態から、億ションを建て、蜂というペットを飼い…弓や装備を作り…どんどん強くなっていくのが楽しかったです🙆‍♀️

次回はボス戦と仰っていたので、楽しみにしてます！☺️

#シェリンの推理ショー"
1366407572446531595,2021-03-01 15:18:46+00:00,小さな頃から完全室内飼いで飼ってきて、半野良飼いしかしたことなかったから最初は可哀想な気がした。お姉ちゃんの方はしなきゃねくらいだったけど弟くんの方の去勢はクルものもあったが、完全室内飼いでやっていくためには絶対必要なことだったし、去勢しない方が可哀想なことになってたと思う
1366379971426459649,2021-03-01 13:29:05+00:00,イタグレちゃん、飼いはじめで近所の人が見慣れてない頃は散歩中によくピンシャーと間違われたり「ガリガリだけどちゃんとご飯あげてるんですか？」ってネグレクト疑われたりしましたね 食ってるよ！こいつら他犬の飯まで食うよ！気を抜いて朝の食パン略奪されたこと何回もあるよ！
1366361781610815489,2021-03-01 12:16:49+00:00,"ヨハネによる福音書 10章 
3 門番は羊飼いには門を開き、羊はその声を聞き分ける。羊飼いは自分の羊の名を呼んで連れ出す。
4 自分の羊をすべて連れ出すと、先頭に立って行く。羊はその声を知っているので、付いて行く。"
1366320586419359745,2021-03-01 09:33:07+00:00,〇〇の飼い方、最初に作ったシナリオなのでKP情報のところに「殴って良いよ」「がんばって」とか書いてある　誰への応援メッセージ？俺か？
1366281462710865923,2021-03-01 06:57:39+00:00,甘ったれた人間なので退色時の鯛世品の返却には家族の人に行ってもらった(最初は大根サービス使うつもりだった)　四天超とノブちゃんが応対してくれたらしい　飼い社の二大天使よ　昨日まで元気(風)にいたやつがいきなりこなくなってこの様では青天の霹靂感あったかもだけど上司が悪いので仕方ない
1366245741748920320,2021-03-01 04:35:43+00:00,"飼い猫を病院に連れて来ました。
注射を打つ時にスタッフの人が
「気が散るように頭を叩いてあげてください」と言うので、
バシバシ叩いてると、あわてたスタッフが
「そんなに叩いちゃちゃかわいそうです！」と。。
最初にちから加減を言っといてちょうだいよ～。
ゴメンネ猫ちゃん。"
1366166745069723648,2021-02-28 23:21:48+00:00,"猫飼いの朝は早い
エサをやれと鳴いて起こされ
エサをやると片方は洗面所で水を飲ませろと呼び、片方はエサが足りないと呼ぶ
終わるとプロレスをはじめ、またエサをくれと鳴きだす"
1366153777296723968,2021-02-28 22:30:17+00:00,俺：飼い猫が脱走した。その後無事に帰って来たのは良かったのだが、額に『肉』と落書きをされていた。最初は愉快だったが、だんだんと腹が立って来た。違うだろう
1366074627747811331,2021-02-28 17:15:46+00:00,ネコを飼いはじめの時知らなくて、腹出しコロンをしてきたから、お腹にソッと手を当てようとしたら、抱え込みガブガブでギョエぁぁ〜ってなったこと思い出した。良き思い出...😌
1366065733831069701,2021-02-28 16:40:25+00:00,"犬の飼いはじめに必要な費用は次のとおりです。

犬の登録：3,000円
狂犬病予防注射：3,500円
健康診断：5,000円～
ワクチン接種：1万5,000円～
ペット用品：2万円～"
1366005496163930117,2021-02-28 12:41:04+00:00,無邪気で無知な飼いたての魈をベッドに突き飛ばしたら「？」って顔で震えてるし、おもいっきり肚兜越しに乳首噛まれて叫ぶのいいな。最初は痛みしか感じなかったけど回数重ねるごとによくなって調教されてくやつ
1365976803307790336,2021-02-28 10:47:03+00:00,平飼い卵ってーのを買ってみただよ。まぁ、スーパーでだけどねぇ😅6個で250円弱ぐらい。取り敢えず最初はゆで卵とかで味を見るべきか…🤔
1365949013778780166,2021-02-28 08:56:37+00:00,飼いはじめは目つき悪かったのに今ではこんなに目クリックリですみたいなパターンの猫たまらん
1365935154246545414,2021-02-28 08:01:33+00:00,猫を飼いはじめ、噛まれるんじゃないかとびくびくするも甘噛みと指吸いされて猫っていいなぁと思う夢
1365912846370971650,2021-02-28 06:32:54+00:00,飼い猫の放し飼いが最初から危険なのはさておきマダニふえるのこわい
1365743841144307712,2021-02-27 19:21:20+00:00,【ﾌﾙｽｺがﾓﾙｶｰ飼いになったらIf(原作再会後)】エ→ﾃﾃﾞｲ種の元野生ﾓﾙｶｰ。ある日怪我した野生ﾓﾙを見付けて保護、お世話する間に最初は警戒して懐かないけど最終的にはめっちゃ仲良しに。休日はよくドライブに出かけて草原を自由に走り回る。元野生なので走るスピードがとても速い
1365718555866529793,2021-02-27 17:40:52+00:00,如何に最初のしらすさんが飼いやすかったのか思い知らさせるな
1365678868363808773,2021-02-27 15:03:09+00:00,イエズス「羊飼い達は、人間となったみことばである私の最初の礼拝者となった。いつか、聖なる無辜の幼子は、私の教会で言われている通り、キリストの最初の殉教者であると言った。今は、羊飼い達が、神のおん体の、最初の礼拝者であると言いたい。」『聖母マリアの詩』
1365625605975207936,2021-02-27 11:31:31+00:00,ダイパリメイクに沸いてる世間。今のこの技術でピカチュウげんきでちゅうをリメイクするべきでは！！？？ポケスナだって出るし！！！派の私ですが、よく考えたらARでピカチュウがいつも一緒！とかになったらそれがきっかけでその内イマジナリーピカチュウまで飼いはじめそうなのでやっぱ駄目ですね
1365378701857230849,2021-02-26 19:10:24+00:00,"犬の飼いはじめに必要な費用は次のとおりです。

犬の登録：3,000円
狂犬病予防注射：3,500円
健康診断：5,000円～
ワクチン接種：1万5,000円～
ペット用品：2万円～"
1365249207041363986,2021-02-26 10:35:50+00:00,"飼い猫を病院に連れて来ました。
注射を打つ時にスタッフの人が
「気が散るように頭を叩いてあげてください」と言うので、
バシバシ叩いてると、あわてたスタッフが
「そんなに叩いちゃちゃかわいそうです！」と。。
最初にちから加減を言っといてちょうだいよ～。
ゴメンネ猫ちゃん。"
1365223185340194820,2021-02-26 08:52:26+00:00,メインスト見直してたら南ってみんな昔馴染み♡ズッ友だったぜ♡って印象に変わってたけど最初は羊飼いさんだー、学校の優しい先生だーくらいだしルチが○○だ？って男らしい話し方してたしミチがめちゃくちゃ魔法使いに噛みついててバチバチしてる面白い。改めて読み返すと楽しい
1365174532965736449,2021-02-26 05:39:07+00:00,猫は人間が文明を築く前から猫だったのですが、猫は食べるのに適さなかったので人間の狩猟の標的ならず、生活圏が被ることで飼い猫が生まれました。猫は最初から可愛かったのです。
1365139011983921156,2021-02-26 03:17:58+00:00,最初ポメラニアンが飼いたかったけどその時たまたまポメラニアンいなくて仕方なくチワワを飼い、名前をポメにしたという飼い主いるんだがポメラニアンに未練ありすぎじゃね
1364947619831758849,2021-02-25 14:37:26+00:00,正直弊所のこはは多分最初期から犬のしつけタイプなのでもはや最初から幻覚を見ていた？？？いやでも絶対しますよだって飼い蛇の餌呑んでるところを「食いしん坊さん」って見てるようなおなごですよ
1364931704398376964,2021-02-25 13:34:12+00:00,YouTubeで一番最初にアップされた動画はYouTube創設者の飼い猫だったが、現在は世界的に「猫を撮らせたら日本人に叶う者は居ない」という定説が有るようで、海外の動画紹介番組でも多くの日本人ユーザーの猫が紹介されている。
1364897720733892618,2021-02-25 11:19:09+00:00,うさ飼いさんへ質問です😅🍮はまだ外出した事がなくて来月2回目の爪切りにうさぎ専門店に行くんですが(初回は先月で寒かったから🏠️に訪問して貰いました)ｷｬﾘｰに入ったのは来たときだけで。ｷｬﾘｰにも慣らさないとと思い、昨日ケージ掃除の時にｷｬﾘｰに入って貰ってたんですが(続きます)
1364841673721700352,2021-02-25 07:36:27+00:00,目が覚めた時最初に目にする光景が猫様の黄門……。猫飼いあるあるなのかな笑笑
1364829264097406981,2021-02-25 06:47:08+00:00,"FF11が60%オフになってたから勢いで買って新規ではじめてみたけど、FF14に飼いならされすぎてどこに行けばいいの？なにをすればいいの？ってなった笑
最初からできる新コンテンツ山盛りだからそれから解放すればいいみたいな情報もよくわからんかったのよね"
1364814149549756423,2021-02-25 05:47:04+00:00,ダリル大大大好きなんだけど、最初めちゃくちゃリスぶら下げて生でリス食べたりリス飼いの私とっても複雑だったｗ
1364799433326563330,2021-02-25 04:48:36+00:00,犬なんて歳とったら室内飼いにしようとしても外に出たがるからな　新たに室内用のしつけしようとしても難しいし、最初から室内飼いするようにしたほうがいい
1364712785372844032,2021-02-24 23:04:17+00:00,門番も羊飼いには門を開けてくれます。彼の声を聞くと、羊は回りに駆け寄って来ます。羊飼いは一匹一匹自分の羊の名を呼んで連れ出すのです。先頭に立つのは羊飼い、羊はそのあとについて行きます。その声を知っているからです。
1364661477337014272,2021-02-24 19:40:25+00:00,"犬の飼いはじめに必要な費用は次のとおりです。

犬の登録：3,000円
狂犬病予防注射：3,500円
健康診断：5,000円～
ワクチン接種：1万5,000円～
ペット用品：2万円～"
1364614324417753091,2021-02-24 16:33:02+00:00,ねこ飼いなのに猫アレルギーで咳が止まらない…呼吸困難とかなる感じの重度じゃないから飼いはじめの何の免疫もないお腹壊してた頃よりかはマシになった気がするけど体調悪いと咳出たり喉腫れたり鼻詰まったり目が痒い。ねこちゃんすき🥺
1364577409169641476,2021-02-24 14:06:21+00:00,最初は1部過激派が騒いでるわ〜で終わったはずの問題が、妙に発言力の強い人が出てきたせいで鳥飼い＝ヤバいという構図ができてて本当に余計なことすんなってしか思わぬ
1364551104218890244,2021-02-24 12:21:50+00:00,個人的には『FtSで強敵が流れ着く村』+『村人が強すぎると言う理由で最初に滅ぼされた村』みたいなイメージがあって、更にただの羊飼いでしかない青年がダガーナイフ1本でモンスターバッサバッサ倒していくもんで、戦闘民族になんの違和感も抱かなかったんだよね…
1364536317640646659,2021-02-24 11:23:04+00:00,大島さんの飼い方がずいぶんアレになってしまったの、最初の猫が特別すぎたのと、その後体調を崩されて入院してた期間に次の猫が懐かなくなってしまったせいで、とにかく数、数、全部かわいそう、全部かわいい！　になっちゃった感じ。
1364499064646111232,2021-02-24 08:55:02+00:00,飼いリヨぐだおくんは最初からきちんと躾れば無害で大人しいけど、一度野生化してしまうと人の手で育てるのは難しいと言われているとかいないとか
1364414851842408449,2021-02-24 03:20:24+00:00,"飼い猫をノラ猫同然に外に出して飼ってる人たちが、外でたとえペットらしき鳥を仕留めて帰ってこようととがめないでしょ？
むしろ大物が取れたねって喜ぶイメージ
せめてそれ以降外で飼わないようにするとかもしないでしょ絶対
そんな気持ちがあれば最初から外で飼ったりしないし"
1364365959457251334,2021-02-24 00:06:08+00:00,"飼い猫を病院に連れて来ました。
注射を打つ時にスタッフの人が
「気が散るように頭を叩いてあげてください」と言うので、
バシバシ叩いてると、あわてたスタッフが
「そんなに叩いちゃちゃかわいそうです！」と。。
最初にちから加減を言っといてちょうだいよ～。
ゴメンネ猫ちゃん。"
1364214401142689797,2021-02-23 14:03:53+00:00,母も子供の頃にセキセイ、文鳥、十姉妹を飼育していたことがあるんだけど、ど昭和の飼い方しか知らなかったのね。だから最初は保温いらん！神経質すぎ！甘やかすな！って死ぬほど言われたんだけど、
1364180804704722949,2021-02-23 11:50:23+00:00,"春雨ガールの飼い猫
「てっちゃん」が
最初彼氏かと思い
「てっちゃんがiPadのコード噛むの！」 てゆーてたから
めちゃめちゃやばめの彼氏だと思った
#spoonSpring"
1364122076185911301,2021-02-23 07:57:01+00:00,モルカー実は放送前からモル飼いのフォロワーで話題になっているので知ってて、最初のバズりで古参ヅラしました。
1364092003995189251,2021-02-23 05:57:32+00:00,セキセイインコを飼いはじめ育成中。雛から育てているので可愛いです。女の子だったらレインボーローズくんのお嫁さんにしてもらいたい( *´艸｀)Grandeur / Snow Man
1364083293709234179,2021-02-23 05:22:55+00:00,カルアシュコネコちゃんの飼い主はヨ旦那で、はじめはアシュ君だけを完全室内飼いで飼ってたけど、野良猫のナさんが窓越しに良くアシュ君に会いに来るようになって、アシュ君もナさんが来ると嬉しそうでとっても遊びたそうだけど、病気とかのリスクがあるため簡単に一緒に遊ばせてあげる事ができなくて
1364004684709597184,2021-02-23 00:10:33+00:00,"犬の飼いはじめに必要な費用は次のとおりです。

犬の登録：3,000円
狂犬病予防注射：3,500円
健康診断：5,000円～
ワクチン接種：1万5,000円～
ペット用品：2万円～"
1363987631026003971,2021-02-22 23:02:47+00:00,パラレル謎設定ですが、猫のラ♀ちゃんが不思議なパワー()で人間化して、最初は今まで通り猫として大切にお世話するもラ♀ちゃんが発情期を迎えた&amp;飼い主くんに恋愛感情を抱いてることにより、可愛い女の子になった飼い猫ちゃん♀とセックスするじゃっくくんの話が読みたい（読みたい）
1363864549175164928,2021-02-22 14:53:42+00:00,"最初汚い色してたけど、なんだかんだ一番塗りの出来が良かった

猫の模様に迷った時はとりあえず飼い猫にしておけばみんなハッピー🙆‍♀️"
1363863839129825284,2021-02-22 14:50:53+00:00,"それはそれは　大昔
物心ついた私の記憶に最初に出て来る場面は、家の土間にあった竈門（本物）の下、火起こしの為の松葉が入れてある空間に数匹の猫たち。土間にも猫たち。正確では無いが猫が10匹くらい、老犬一匹。私がまだ3歳だろうか。飼い猫とか野良猫とか野良犬とかまだ区別もない時代のおはなし"
1363851237012111366,2021-02-22 14:00:48+00:00,桐生家の飼い猫さん、最初は野良の暖くんを全く相手にしないけど彼はそう簡単に諦める男ではないのだ
1363842488830545927,2021-02-22 13:26:02+00:00,こやさん、最初のうちはえぺ配信で｢写真は出さないかな｣みたいなこと仰ってたけど気付いたらオープン系猫飼いになっててかわいい
1363842437597171712,2021-02-22 13:25:50+00:00,譲渡された仔達が最初から室内飼いであることを期待する。もう昭和の飼い方はやめて欲しい。あの頃とは気象も大気も違うのだから。冬はあり得ない程の大雪や吹雪等の寒波が襲い、夏は体温以上の猛暑。常に霞がかっている汚れた空気。犬は外の時代は終わった。折角手に入れた縁が幸せに永続する為にも。
1363797056259649536,2021-02-22 10:25:30+00:00,"顔に傷のある白い野良猫さねと、室内飼いされてる青みかかった黒い毛並みのぎゆ。
窓越しに出会った2匹、最初は育ちのいいぎゆを嫌って邪険にするけど、自由に生きてるさねに憧れて健気についてまわるぎゆに絆され仲良しに。ある日ボス猫きぶつじに襲われて？！
というハートフルストーリーを妄想中。"
1363691545828814850,2021-02-22 03:26:15+00:00,従兄弟が猫を飼いはじめその子に兄弟がいるからお前も飼え言われた
1363687051380494341,2021-02-22 03:08:23+00:00,最初からいる飼い猫。生まれてすぐに家のオス猫にほれ込んで家に住み着き、ずっといるメス猫。近所の飼い主の老人がなくなってノラ化しかけところに家に入り込んで勝手に飼い猫になった猫と、家にやってくる猫にもいろいろなドラマがあるんだなと思いました。
1363686093120434176,2021-02-22 03:04:35+00:00,最初から飼っている飼い猫のオスにほれ込んで、毎日家の庭に居続けてアプローチし続けた挙句、他所からやってきたメスの猫をすべて追いかけて追い払ったメスの飼い猫の根気に負けて飼い猫にしたんだけど、家で安定した生活ができるようになったら、完全に自分を召使扱いしてる（親は飼い主扱い）……。
1363670096774713347,2021-02-22 02:01:01+00:00,やりたいことをやる。としていたら猫が四匹になっちゃった。最初は実家でも飼ったことがなく勇気出して、二匹目はラナイ島のコエレが他界したので代わりにと捨てられた子を引き取った。三匹目は友人が亡くなり飼い猫を。そもそも私が拾った子。最後はコエレに似てる子。やりたいことは猫と生きること。
1363669931531726853,2021-02-22 02:00:22+00:00,俺：飼い猫が脱走した。その後無事に帰って来たのは良かったのだが、額に『肉』と落書きをされていた。最初は愉快だったが、だんだんと腹が立って来た。違うだろう
1363627132048449537,2021-02-21 23:10:17+00:00,"先月、16年半共に暮らしたワンコを看取りました
特に最期の老犬介護は、本当に大変でした
でも、コロナで在宅ワークのお陰で、悔いなく介護できました

動物は人間の3〜4倍で時間が進みますが、それを感じるのは、飼いはじめの若い頃ではなく、老いてからです

続く
#jwave 
#ohayomorning 
@jtmr813"
1363588206277484544,2021-02-21 20:35:37+00:00,"同期の子が猫を飼いはじめたんす。「今もかわいいけど、大きくなってきて。子猫もう1匹飼いたい」
何も言えなかった。大きくなったらなんなんですかね？ちゃんと最後まで飼えるんかな？
私は小さい時も大きい時もどんな時もかわいいし大事だけど。"
1363449069360738304,2021-02-21 11:22:44+00:00,"例の某芸能人、擁護派のファンから「最初から譲渡目的で飼い、シッターさん雇ったりちゃんと躾入れて譲渡してる」て話が出てきてて、故意にかわいい盛りを楽しんだら里子に出してる知り余計印象悪くなったわ。
何匹も同じことしてるそうだし。
色んな考え方はあるけど、ちょっと私は合わないかな。"
1363392319588761602,2021-02-21 07:37:14+00:00,"飼い猫を病院に連れて来ました。
注射を打つ時にスタッフの人が
「気が散るように頭を叩いてあげてください」と言うので、
バシバシ叩いてると、あわてたスタッフが
「そんなに叩いちゃちゃかわいそうです！」と。。
最初にちから加減を言っといてちょうだいよ～。
ゴメンネ猫ちゃん。"
1363271555317305345,2021-02-20 23:37:21+00:00,久しぶりに『闇金ウシジマくん』読んでるが、最初読んでた当時はウシジマ社長がうさぎ好きな設定好きだったけど、今改めて見るとちゃんとした飼い方してねえな！？うさまくらとか、餌の人参切った包丁とまな板をうさぎ放した部屋の床に放置してるのとか。うーん…
1363211950058954754,2021-02-20 19:40:30+00:00,"犬の飼いはじめに必要な費用は次のとおりです。

犬の登録：3,000円
狂犬病予防注射：3,500円
健康診断：5,000円～
ワクチン接種：1万5,000円～
ペット用品：2万円～"
1363151802233884672,2021-02-20 15:41:30+00:00,最初から飼い猫みたいに懐いてるテイルモンなんて……テイルモンじゃない……
1363100899023978498,2021-02-20 12:19:14+00:00,マイクラ攻略みたいなの見てたら最初は猫は村人にしか懐いていません！って出てきて でも鮭かなんかあげて手懐けた でもこのネコチャンも村人の飼い猫なんよ 亡くなった村人の もうなにもできないこれ以上
1363087855829065728,2021-02-20 11:27:24+00:00,"今週、子どもにウケたのは、名作スーホの白い馬の最初を、
「オ↑レはスーホ。モンゴルのまずしい羊飼いの少年だ。得意なことはカラオケだぜ。」
って読んだ時かな。
一人称がオレの子は、誰も自分がオ↑レって言ってることに気づいてない。"
1363036422693785606,2021-02-20 08:03:01+00:00,某SNSでフォローしているインストラクターさんが猫を拾い、こんないい子が捨てられるなんて！と怒りながら飼いはじめ、よかったよかったと思っているのだが。少し不安なのは、インスタにアップされるぬこさんがどんどんどんどん横にビッグになっていくこと…。だ、大丈夫か？？
1362779041078542336,2021-02-19 15:00:17+00:00,俺：飼い猫が脱走した。その後無事に帰って来たのは良かったのだが、額に『肉』と落書きをされていた。最初は愉快だったが、だんだんと腹が立って来た。違うだろう
