id,date,tweet
1410956557123088390,2021-07-02 13:40:32+00:00,"志典（TW）：ある日…いつも可愛がってる飼い猫と遊ぶ夢を見た。数日後またその猫が夢に出てきて…｢初回は無料サービスやったけど、二回目からは寿命三か月分もらっていくで｣…とかなり流暢な関西弁で言ったんだ…。あいつ、関西弁だったのか…知らなかった…… 
禰寿々：そこじゃないよ父さん！"
1410879641808633857,2021-07-02 08:34:54+00:00,ポメラニアンの多頭飼いしてたときは、ホント大変だったんだよ…来客。でも、来てすぐの最初だけだけだったかな〜。それでもそれぞれ個性があってスーツ着てるような人が来るとピトっとくっついて離れないコとか、他が吠えててもドシーンと構えてシカトってコもいたし。
1410877394714386439,2021-07-02 08:25:58+00:00,そうなんだよね～。飼いはじめの時ほら～にんじんだよ～ってあげたら、葉っぱだけたべて残してて、そっか～てなった。乾燥させた根菜にんじんは好きなんだけど生は葉っぱとかが好きなんだよねぇ。あげすぎちゃうと水分多いからお腹のためにも適量で基本的には歯のためにも牧草なんだけど
1410838793318375428,2021-07-02 05:52:35+00:00,"いいなあ、うちは飼いはじめがもう成猫に近かったんで、膝にものらなきゃケットですらかぶってくれぬ＞RT

頭は噛むけどね"
1410781577563439108,2021-07-02 02:05:13+00:00,"平飼い卵

スーパーで安い卵を買うのをやめました。最初はすごく抵抗があったけど。
安い卵3個食べるのと高い卵1個を大事に食べるのとでは栄養的にどうなのかと。
安い卵は羽も広げられないゲージで飼われてストレスフル、抗生物質使用、粗悪なエサで飼われている。
今は気持ち悪くて食べられない。"
1410669608311287809,2021-07-01 18:40:18+00:00,"犬の飼いはじめに必要な費用は次のとおりです。

犬の登録：3,000円
狂犬病予防注射：3,500円
健康診断：5,000円～
ワクチン接種：1万5,000円～
ペット用品：2万円～"
1410577898872872963,2021-07-01 12:35:53+00:00,"飼い猫を病院に連れて来ました。
注射を打つ時にスタッフの人が
「気が散るように頭を叩いてあげてください」と言うので、
バシバシ叩いてると、あわてたスタッフが
「そんなに叩いちゃちゃかわいそうです！」と。。
最初にちから加減を言っといてちょうだいよ～。
ゴメンネ猫ちゃん。"
1410562486118481920,2021-07-01 11:34:38+00:00,門番も羊飼いには門を開けてくれます。彼の声を聞くと、羊は回りに駆け寄って来ます。羊飼いは一匹一匹自分の羊の名を呼んで連れ出すのです。先頭に立つのは羊飼い、羊はそのあとについて行きます。その声を知っているからです。
1410533785058246657,2021-07-01 09:40:35+00:00,"室内入れはじめ
（こんなになついてる！ずっと室内飼いにしよ！）

１ヶ月後
（わかったわかった外に出ていいから！わかった！）"
1410505954748030977,2021-07-01 07:50:00+00:00,"10年ほど前のこと。
愛犬を散歩させていると突然、
綱を振り切り茂みに突撃しました！

数分後、何かを咥えて戻って来たのですが
それはなんと

亀！！

なんとなく縁を感じ、
持ち帰って飼いはじめ、
愛犬亡き後も我が家のマスコットです。

#企業公式がお疲れ様を言い合う 
#企業公式相互フォロー"
1410345390730190850,2021-06-30 21:11:58+00:00,"ちなみに

1度外の世界に慣れたらなかなか、室内飼いに慣らすのは難しいので

はじめが肝心かと

外猫を家猫にするのは根性いると思う"
1410232501163806725,2021-06-30 13:43:23+00:00,東京に出るためにN95マスクを付けているんだけど、昨日も今日も、声の調子が良い。いつもは喉の奥にかすかに痰があって、声がかすれ気味なのを発声練習で邪魔する部分を探して、咳払いしながら取るんだけど、それが最初からない。ということは、原因は加齢ではなく、飼い猫だったか。。。家でもN95を？
1410173144942268418,2021-06-30 09:47:32+00:00,"昨日の羊飼いKさんの生配信、マーダーミステリーを初めて最初から最後まで見れた。Kさんの言葉の紡ぎ方や、GMのいそかりさんの優しさ。それから、している側だけでなく視聴者側も深く考えさせられるような内容だったなと個人的に感じた。
#マーダーミステリー
#マダミス
#箱庭の観測者様へ"
1410161992371822593,2021-06-30 09:03:13+00:00,"最初の頃の印象が変わった人
羊飼いKさん→穏やかで優しい方かなと思ったらゲス笑いがやばかった

GEN→真面目な方かなと思ったらかわいい一面がけっこうある

しんたろー→リア狂かなと思ったら、議論つよつよでしかも天然でかわいい

ふじみや→大人しくて、落ち着いてるな思ったら、ガチ狂人"
1410153114997452801,2021-06-30 08:27:56+00:00,"飼い猫、人懐こくなった？　　都市封鎖でペットに変化　英研究
イギリスってのは　大学が結構こういうの好きなんだねーー　日本のは全然聞こえてこないからな
変異株だって最初　イギリスだっらからな
ユーロから　出たいってのもその辺りだったのかな"
1410041296090136576,2021-06-30 01:03:36+00:00,"今朝は5時半にネッコのゲロ音で起こされた
猫飼い、どんなに熟睡してても最初の「ｺｯ……」で飛び起きる能力が付与される"
1410040375582937088,2021-06-30 00:59:57+00:00,"「手術する」と支援募って手術せずとか「保護猫の治療に支援を」と言って飼い猫にしたりとか、収支報告は適当とか…とにかく最初から一般常識的におかしいから…正論を言っても仕方ないのかも知れない

でもこの矛盾に一人でも気付いて欲しい

綺麗な写真と言葉だけに踊らされないで欲しい"
1410035341856182272,2021-06-30 00:39:57+00:00,最初に飼い始めた子が事故で死んだ時はめちゃくちゃショックで三日くらい思い出し泣きしてた。飼い猫よ健やかであれ🙏
1410023174570340352,2021-06-29 23:51:36+00:00,最初は慣れない様子だったのに多頭飼いしていくうちにお互いの顔を舐め合うようになった子猫ちゃんを見ているような気持ちになる。
1409992671054032897,2021-06-29 21:50:23+00:00,この前、ごみ袋に仔猫４匹を入れて捨てた犯人が捕まりました💢飼い猫が産んだ仔猫で育てられないということで捨てたそうだ💢💢育てられないなら最初から飼うんじゃないよ💢💢って言いたい💢💢
1409982581131464705,2021-06-29 21:10:18+00:00,"犬の飼いはじめに必要な費用は次のとおりです。

犬の登録：3,000円
狂犬病予防注射：3,500円
健康診断：5,000円～
ワクチン接種：1万5,000円～
ペット用品：2万円～"
1409893664705314821,2021-06-29 15:16:58+00:00,バカラのルージュ540は最初苦手だったけど最近好きになってきたやつで、しかしこの香水振ると飼い猫が過剰に嫌がるのでもう使えないな…ってなってる😌
1409846877428719623,2021-06-29 12:11:03+00:00,治療を受けて寛解した患者さんのインタビュー。最初はいなかった飼い猫が最後のほうで患者さんのそばに陣取ってて、人間たちがなんか集まってるからとりあえず自分も参加しとくかの猫精神に和みました。インタビューの内容は壮絶だっただけに……＞RT
1409806741135499264,2021-06-29 09:31:34+00:00,猫の多頭飼い最初は不安やったけど1匹よりもストレスなさそうで結果的に正解やったね
1409739919673552902,2021-06-29 05:06:03+00:00,"飼い猫を病院に連れて来ました。
注射を打つ時にスタッフの人が
「気が散るように頭を叩いてあげてください」と言うので、
バシバシ叩いてると、あわてたスタッフが
「そんなに叩いちゃちゃかわいそうです！」と。。
最初にちから加減を言っといてちょうだいよ～。
ゴメンネ猫ちゃん。"
1409737109204656132,2021-06-29 04:54:53+00:00,しかも党派主義に侵され偏向している。マスメディアは飼いならされており牙が抜けた。そういう時に社会一般の方の背中を改善に押すのは公共心です。ロビイング活動をはじめたり、民生委員になったり、頑固な個人活動にしたり。
1409498758824402946,2021-06-28 13:07:45+00:00,藤トワもレイトワもいつか犬飼いはじめそう
1409464685271785478,2021-06-28 10:52:22+00:00,こ…これ面白いの…？？って感じで始めたんですけどパネル事故をなんとかやりくりするジレンマと達成感に無事飼いならされたのだ。楽しいよ！最初からコンテンツ豊富でビビるよ！
1409460154764984324,2021-06-28 10:34:22+00:00,犬の多頭飼いいいなーって思うけど金銭的に無理だしいちばんは散歩が無理だーーー最初は父も散歩行くって約束で飼ったのに🙄
1409429950470365189,2021-06-28 08:34:20+00:00,"ネズミにあれこれやられてけっこうショックだった身としては、ヘビがネズミをガンガン追い出してく様はかなり爽快。映像はややグロかもなのでRTしないけど。
ただ、シマヘビ飼ってる方のツイを見ると、成長期じゃなかったり飼いはじめ等はビックリするほど食欲ないのがヘビのデフォみたいで…"
1409388871679315969,2021-06-28 05:51:06+00:00,"【スカウト予告】

6月29日 15:00〜『スカウト！オーシャンズ』を開催予定🌸

▽あらすじ
｢オーシャンズ｣の活動でエビを育てることになった泉。颯馬をはじめとした｢オーシャンズ｣のメンバーに生き物の飼い方を教えてもらうのだが…

期間中、新規ストーリーは無料公開✨

#あんスタ"
1409273185535627267,2021-06-27 22:11:25+00:00,"誰だ飼い猫を捨てたやつ
歩幅合わせてくれるめちゃくちゃ賢い猫じゃんって思ったら
飼い猫の特徴あるやん
飼えないくらいなら最初から飼うな！
1つの命やぞ
ふざけんなよ"
1409255270551678977,2021-06-27 21:00:13+00:00,俺：飼い猫が脱走した。その後無事に帰って来たのは良かったのだが、額に『肉』と落書きをされていた。最初は愉快だったが、だんだんと腹が立って来た。違うだろう
1409227607866961920,2021-06-27 19:10:18+00:00,"犬の飼いはじめに必要な費用は次のとおりです。

犬の登録：3,000円
狂犬病予防注射：3,500円
健康診断：5,000円～
ワクチン接種：1万5,000円～
ペット用品：2万円～"
1409190733890789376,2021-06-27 16:43:47+00:00,"男性が女性にアクセサリー(例えばネックレスとか)を贈るのは、飼い猫に首輪を付けるのと同じらしい。。。

↑この論が正しいなら、自分で買う物は、何の意味も無いよね…⁇

(´-ω-`)=3

中途半端に飼うなら、最初から飼わないで欲しいわ(　˙-˙　)真顔"
1409144372801638402,2021-06-27 13:39:33+00:00,"最初は「可愛い」から始まり、それが不幸な多頭飼いになった。外部の接触も上手くいかず孤立していく。
手を差し伸べる人が居る、人も猫も平凡な幸せが訪れますように。
人間の我儘で猫が犠牲になりませんように。
花の木シェルターのサカタさん、只々頭が下がります。
＃ノンフィクション"
1409141684512845824,2021-06-27 13:28:52+00:00,わんちゃん飼っている方がにゃんちゃんも飼いはじめ2匹が仲良く寝ている写真上げてくれていて幸せ感じる･･･癒し効果が凄い🤦‍♀️😂🙏✨
1409124372162367496,2021-06-27 12:20:05+00:00,長年行ってる美容師さん、２年前に子猫を拾って飼いはじめ、良かった事があったと。それは、生まれて初めて可愛いという感情を認識したこと。とってもいい話で、うるうるしちゃいました。
1409108716666822659,2021-06-27 11:17:52+00:00,"心が荒んでるから癒しを求めて大図書館の羊飼いの最初やってるけど高峰に癒されるわ……
この気持ち……もしかして……恋……？("
1409066696023834624,2021-06-27 08:30:54+00:00,家事しながら人狼最大トーナメントを途中から聞いてた。今日のカズさんなんか声がこもってるな、zoomだからかな、などと思っていたら…羊飼いKさんかい！！😳いやいや顔だけじゃなくて声も似すぎでしょ。最初本当普通に聞き流してたわ…
1409026237826158593,2021-06-27 05:50:08+00:00,"#ノンフィクション
猫の多頭飼育崩壊を起こす原因は飼い主の社会からの孤立が原因
寂しさから猫を飼いはじめ、不妊手術もしないから、どんどん増え崩壊。
社会の歪みが猫にいくとは…泣"
1408964490402570247,2021-06-27 01:44:46+00:00,"いやまぁ個人的にはCS化でCG追加とかあんまり……ねぇ？派なので……

大図書館の羊飼いは全部(原作 FD CS版)初回限定盤仕入れるに値する出来でした"
1408954072158248961,2021-06-27 01:03:22+00:00,そうよね。セキセイさんは飼いやすいし買いやすいとは思うけど、お金かかるのは事実。器質的な弱さもあるしそもそも最初にメガバクありきなので初期費用が生体の3倍くらいだよね。犬猫の予防接種と同じ。ていうか生き物をお迎えするのは大小同じよね。
1408854791875297287,2021-06-26 18:28:52+00:00,"飼い猫いなくなって探してた人、どうなったか気になってしまうんだけどいまだに見つかってないみたい…
まあ…そうだろうな…
正式に依頼する前に相談も出来るし最初からプロ頼ればいいのにって"
1408815335952707591,2021-06-26 15:52:05+00:00,今まで観てきた浅い経験ですが、グニョンへのフジュンの口調、一番近いのが、ウギョルの一番最初に、飼い猫カーンちゃんに、アッパが結婚するよーって話しかけてるところだと思います、気楽に話してる口調ってことかなぁー☺️
1408765946433441796,2021-06-26 12:35:49+00:00,"飼い猫を病院に連れて来ました。
注射を打つ時にスタッフの人が
「気が散るように頭を叩いてあげてください」と言うので、
バシバシ叩いてると、あわてたスタッフが
「そんなに叩いちゃちゃかわいそうです！」と。。
最初にちから加減を言っといてちょうだいよ～。
ゴメンネ猫ちゃん。"
1408749057057558528,2021-06-26 11:28:43+00:00,飼い猫が帰宅してからﾆｬｱｺﾞﾆｬｱｺﾞうるさい(※ご飯食べている姿を見てほしい模様)ので、「クワイエットプレイスだったら貴方は一番最初に死んでますよ!!!!」って注意したらめちゃくちゃデカイ声で「ﾌﾞﾆｬｱｱｱｱｱｱｱ!!!!」とお返事いただいた
1408676569862721538,2021-06-26 06:40:40+00:00,"最初随分髪長い彼女やなと思ってたら
ラスサビの飼い猫オチ
まじで笑った."
1408628635402063874,2021-06-26 03:30:12+00:00,俺：飼い猫が脱走した。その後無事に帰って来たのは良かったのだが、額に『肉』と落書きをされていた。最初は愉快だったが、だんだんと腹が立って来た。違うだろう
1408616752079011844,2021-06-26 02:42:59+00:00,"退去時って本当に人間性がよく出ますよね💦

明らかに飼い猫の引っ掻き傷なのに、壁紙のリフォーム代をなかなか認めない入居者。

「最初から壁紙破れてました。」

なんですぐバレる嘘つくんだ？
こういう対応、本当に疲れるわ…😣💦"
1408608837322493952,2021-06-26 02:11:32+00:00,Switch版大図書館の羊飼いの初回限定版が中古7400円で売ってた。欲しいけどどうしよっかな
1408602806995415044,2021-06-26 01:47:34+00:00,考えたら飼ってた犬みんないい子で飼いやすかった。夜吠える子もいたけど救急車と近所の犬の遠吠えは仕方なかったかな。最初の犬は1週間しか居なかったけど多分柴混じりだったと思うけどあの子が一番頭よかった。子犬と成犬の間くらいだったけど1週間で待てとお座り覚えてたのはほんと賢いわ。
1408589214464151557,2021-06-26 00:53:33+00:00,"そうそう、ネズミさんなんて2～3年が
寿命だわ！と最初から思ってた
ハム飼い経験者🐭　＃正義のミカタ"
1408562270976626688,2021-06-25 23:06:29+00:00,"愛犬一号は彼氏じゃないけど、ある程度を許容してくれる優しさがある。
けどみっともなく縋ってくるギャップが可愛いから、いじめてあげたくなっちゃう(*´﹃｀*)💕

あと言葉遣いが最初からなってたから、M男を飼うことに慣れてない私でも飼いやすかった←初心者には重要よね"
1408495277338624000,2021-06-25 18:40:17+00:00,"犬の飼いはじめに必要な費用は次のとおりです。

犬の登録：3,000円
狂犬病予防注射：3,500円
健康診断：5,000円～
ワクチン接種：1万5,000円～
ペット用品：2万円～"
1408470191478956033,2021-06-25 17:00:36+00:00,"本当に毎年夏のはじめがダメ。

「床に落ちてる猫」の動画をみて
人間だってたまには床に落ちててもいいよね…と思いながら1日中落ちていました。

室内飼いの猫に生まれてたパターンで1週間くらい生きてみたい。"
1408458193194274820,2021-06-25 16:12:55+00:00,"近所の野良猫？飼い猫？がすごい鳴いててちょい怖い😭
最初赤ちゃんかと思った。。"
1408251219169079297,2021-06-25 02:30:29+00:00,俺：飼い猫が脱走した。その後無事に帰って来たのは良かったのだが、額に『肉』と落書きをされていた。最初は愉快だったが、だんだんと腹が立って来た。違うだろう
1408118464401723397,2021-06-24 17:42:58+00:00,飼いはじめの頃に使っていたケージを掃除のときに入れておく用として使っているんですが箱がちっちゃくてびっくりしますね……いつの間にこんなに大きくなったの
1407945736658898946,2021-06-24 06:16:36+00:00,大図書館の羊飼いの初回限定のやつが2500って、平常？
1407927965464158209,2021-06-24 05:05:59+00:00,"飼い猫を病院に連れて来ました。
注射を打つ時にスタッフの人が
「気が散るように頭を叩いてあげてください」と言うので、
バシバシ叩いてると、あわてたスタッフが
「そんなに叩いちゃちゃかわいそうです！」と。。
最初にちから加減を言っといてちょうだいよ～。
ゴメンネ猫ちゃん。"
1407713286028550149,2021-06-23 14:52:56+00:00,仲里依紗ちゃんのノーカットノー編集の動画見たけど、面白すぎる！最初飼い猫のおかかさん、カメラの前行ったり来たりして、途中凄いモフモフで画面いっぱいになった😊かわいい～☺️
1407689364935569414,2021-06-23 13:17:52+00:00,"今日、バイトで卵の品出しをしてたら、お客さんに「おススメの卵どれですか？」って聞かれかたら、うちの店で一番高い、１パック400円もする「平飼いたまご」をおススメしたら「じゃ、これにするわ」って買ってってくれた（笑）
そのお客さん最初手に持ってたのうちの店の一番安い普通の卵だった（笑）"
1407687459945684995,2021-06-23 13:10:18+00:00,"犬の飼いはじめに必要な費用は次のとおりです。

犬の登録：3,000円
狂犬病予防注射：3,500円
健康診断：5,000円～
ワクチン接種：1万5,000円～
ペット用品：2万円～"
1407677388347953153,2021-06-23 12:30:17+00:00,"爬虫類YouTuberの方の
動画を見ていると最初は
基本的な飼い方等の動画
から始まるのだがネタが
無くなると新しい爬虫類
を飼い始め増えて行く…
お迎えしましたって見ると
あの事件をおもいだすのは偏見かも知れないが…
ぽかは、一匹のペットに
愛情を注ぎたい。動物園
するんじゃないから"
1407663301744414720,2021-06-23 11:34:18+00:00,スピメアさんが「いい羊飼いにしてね」って言った時点ではラキストとスピメアさんの目的はいい羊飼い（＝力のあるラッソ家の人間）を育てることで合意してた…と思ったけど、そうなのか？そもそもラキスト、はじめから羊飼いに育てる気無さそう…？
1407584366931238914,2021-06-23 06:20:39+00:00,羊飼いKさんの動画見漁ってるけど、GENさんが「GENです」って言う度に(みんな大好き)とか最初に入れてるの毎回笑うｗｗｗｗｗｗｗｗ
1407516918165118977,2021-06-23 01:52:38+00:00,多頭飼いなんて目に見えてたんだから最初から大きなラックを買うべきだった…笑
1407465966859030531,2021-06-22 22:30:10+00:00,俺：飼い猫が脱走した。その後無事に帰って来たのは良かったのだが、額に『肉』と落書きをされていた。最初は愉快だったが、だんだんと腹が立って来た。違うだろう
1407375776203173888,2021-06-22 16:31:47+00:00,"例の人ただのかまってちゃんみたいだな…猫が死んだってのも本当なのかも疑問。そもそも花を口にして死んだのに複数飼いしてて仏壇に花を置くかね？
ワイ単純に輸入切花について知りたかっただけなのよ？？いくら安く仕入れても航空便使ったら激安にはできないと思うの。一番最初に就職したのが→"
1407231020550656001,2021-06-22 06:56:35+00:00,"○○とどこかの広場にあるクリスマスツリーを眺める
最初は透明だけど段々と下から緑に色付いていくのを繰り返す
予定があって飼い猫のもかと一緒に走って向かう
ギリギリで焦って目的についたら2分くらい遅刻して絶望的気分"
1407133338146545665,2021-06-22 00:28:25+00:00,2.当時ネコ捕獲が本格化していたが、村に飼い猫登録し、父島に出かけるときは1回は連れて行った（泊まりOKの宿を探した）、置いていくときは友人に世話を頼んだ。最初の住まいは3畳間。そこに猫トイレ置いて、布団敷いて一緒に寝てた。すでに腎臓病だったけど、当時は元気だったからできたこと。
1406998685972516864,2021-06-21 15:33:22+00:00,"魔王軍の将校である魔物娘さんに戦闘で打ち倒されたあと捕虜にされ、力ずくで飼い馴らされていく過程を妄想しながら寝ます

最初は自分に敗北と屈辱を与えた憎悪と敵意が心を占めてるけど、向こうから下される命令をあからさまに無視しては力で無理やり従わされて、少しずつ恐怖に上書きされていくやつ"
1406962687632822277,2021-06-21 13:10:19+00:00,"犬の飼いはじめに必要な費用は次のとおりです。

犬の登録：3,000円
狂犬病予防注射：3,500円
健康診断：5,000円～
ワクチン接種：1万5,000円～
ペット用品：2万円～"
1406946458620686340,2021-06-21 12:05:50+00:00,"飼い猫を病院に連れて来ました。
注射を打つ時にスタッフの人が
「気が散るように頭を叩いてあげてください」と言うので、
バシバシ叩いてると、あわてたスタッフが
「そんなに叩いちゃちゃかわいそうです！」と。。
最初にちから加減を言っといてちょうだいよ～。
ゴメンネ猫ちゃん。"
1406918849082007555,2021-06-21 10:16:07+00:00,"なっ…!!

3匹同時飼い…(‘‘*)!!

なんてことなんてこと(‘‘*)(*’’)

かわいすぎます…!!(笑)

最初に飼えるリヴリーも登場して、本当にわくわくが止まりません…!(笑)(‘‘*)

6万人も事前登録突破して、
クラシックアイランドが

…もはや手に入った想像が止まらない…(‘‘*)(笑)

(続きます)"
1406901487167426561,2021-06-21 09:07:08+00:00,"びゃ！！可愛い！！！多頭飼い最初から実装されるの！！？？
くりふさん飼っちゃお"
1406852008234000386,2021-06-21 05:50:31+00:00,最初から多頭飼いができるならハミ保育園をひらくか
1406787560643260416,2021-06-21 01:34:25+00:00,君は先頭に立って走っているのだね？－それは羊飼い［群を統べる者から、指導者、統治者の意］としてか？それとも例外者としてか？第三の場合は逃亡者ということになろう。…第一の良心の問題。－偶像の黄昏－
